[
  {
    "age": 0,
    "geo": "AR",
    "persons": 638048.0,
    "retrieved_at": "2026-10-02",
    "sex": "both",
    "source": "MOCK",
    "year": 2000
  },
  {
    "age": 1,
    "geo": "AR",
    "persons": 634720.0,
    "retrieved_at": "2026-10-02",
    "sex": "both",
    "source": "MOCK",
    "year": 2000
  },
  {
    "age": 2,
    "geo": "AR",
    "persons": 631194.0,
    "retrieved_at": "2026-10-02",
    "sex": "both",
    "source": "MOCK",
    "year": 2000
  },
  {
    "age": 3,
    "geo": "AR",
    "persons": 627504.0,
    "retrieved_at": "2026-10-02",
    "sex": "both",
    "source": "MOCK",
    "year": 2000
  },
  {
    "age": 4,
    "geo": "AR",
    "persons": 623669.0,
    "retrieved_at": "2026-10-02",
    "sex": "both",
    "source": "MOCK",
    "year": 2000
  },
  {
    "age": 5,
    "geo": "AR",
    "persons": 619701.0,
    "retrieved_at": "2026-10-02",
    "sex": "both",
    "source": "MOCK",
    "year": 2000
  },
  {
    "age": 6,
    "geo": "AR",
    "persons": 615607.0,
    "retrieved_at": "2026-10-02",
    "sex": "both",
    "source": "MOCK",
    "year": 2000
  },
  {
    "age": 7,
    "geo": "AR",
    "persons": 611397.0,
    "retrieved_at": "2026-10-02",
    "sex": "both",
    "source": "MOCK",
    "year": 2000
  },
  {
    "age": 8,
    "geo": "AR",
    "persons": 607075.0,
    "retrieved_at": "2026-10-02",
    "sex": "both",
    "source": "MOCK",
    "year": 2000
  },
  {
    "age": 9,
    "geo": "AR",
    "persons": 602648.0,
    "retrieved_at": "2026-10-02",
    "sex": "both",
    "source": "MOCK",
    "year": 2000
  },
  {
    "age": 10,
    "geo": "AR",
    "persons": 598120.0,
    "retrieved_at": "2026-10-02",
    "sex": "both",
    "source": "MOCK",
    "year": 2000
  },
  {
    "age": 11,
    "geo": "AR",
    "persons": 593496.0,
    "retrieved_at": "2026-10-02",
    "sex": "both",
    "source": "MOCK",
    "year": 2000
  },
  {
    "age": 12,
    "geo": "AR",
    "persons": 588780.0,
    "retrieved_at": "2026-10-02",
    "sex": "both",
    "source": "MOCK",
    "year": 2000
  },
  {
    "age": 13,
    "geo": "AR",
    "persons": 583976.0,
    "retrieved_at": "2026-10-02",
    "sex": "both",
    "source": "MOCK",
    "year": 2000
  },
  {
    "age": 14,
    "geo": "AR",
    "persons": 579087.0,
    "retrieved_at": "2026-10-02",
    "sex": "both",
    "source": "MOCK",
    "year": 2000
  },
  {
    "age": 15,
    "geo": "AR",
    "persons": 574117.0,
    "retrieved_at": "2026-10-02",
    "sex": "both",
    "source": "MOCK",
    "year": 2000
  },
  {
    "age": 16,
    "geo": "AR",
    "persons": 569068.0,
    "retrieved_at": "2026-10-02",
    "sex": "both",
    "source": "MOCK",
    "year": 2000
  },
  {
    "age": 17,
    "geo": "AR",
    "persons": 563944.0,
    "retrieved_at": "2026-10-02",
    "sex": "both",
    "source": "MOCK",
    "year": 2000
  },
  {
    "age": 18,
    "geo": "AR",
    "persons": 558748.0,
    "retrieved_at": "2026-10-02",
    "sex": "both",
    "source": "MOCK",
    "year": 2000
  },
  {
    "age": 19,
    "geo": "AR",
    "persons": 553481.0,
    "retrieved_at": "2026-10-02",
    "sex": "both",
    "source": "MOCK",
    "year": 2000
  },
  {
    "age": 20,
    "geo": "AR",
    "persons": 548146.0,
    "retrieved_at": "2026-10-02",
    "sex": "both",
    "source": "MOCK",
    "year": 2000
  },
  {
    "age": 21,
    "geo": "AR",
    "persons": 542747.0,
    "retrieved_at": "2026-10-02",
    "sex": "both",
    "source": "MOCK",
    "year": 2000
  },
  {
    "age": 22,
    "geo": "AR",
    "persons": 537285.0,
    "retrieved_at": "2026-10-02",
    "sex": "both",
    "source": "MOCK",
    "year": 2000
  },
  {
    "age": 23,
    "geo": "AR",
    "persons": 531762.0,
    "retrieved_at": "2026-10-02",
    "sex": "both",
    "source": "MOCK",
    "year": 2000
  },
  {
    "age": 24,
    "geo": "AR",
    "persons": 526181.0,
    "retrieved_at": "2026-10-02",
    "sex": "both",
    "source": "MOCK",
    "year": 2000
  },
  {
    "age": 25,
    "geo": "AR",
    "persons": 520543.0,
    "retrieved_at": "2026-10-02",
    "sex": "both",
    "source": "MOCK",
    "year": 2000
  },
  {
    "age": 26,
    "geo": "AR",
    "persons": 514852.0,
    "retrieved_at": "2026-10-02",
    "sex": "both",
    "source": "MOCK",
    "year": 2000
  },
  {
    "age": 27,
    "geo": "AR",
    "persons": 509107.0,
    "retrieved_at": "2026-10-02",
    "sex": "both",
    "source": "MOCK",
    "year": 2000
  },
  {
    "age": 28,
    "geo": "AR",
    "persons": 503312.0,
    "retrieved_at": "2026-10-02",
    "sex": "both",
    "source": "MOCK",
    "year": 2000
  },
  {
    "age": 29,
    "geo": "AR",
    "persons": 497469.0,
    "retrieved_at": "2026-10-02",
    "sex": "both",
    "source": "MOCK",
    "year": 2000
  },
  {
    "age": 30,
    "geo": "AR",
    "persons": 491579.0,
    "retrieved_at": "2026-10-02",
    "sex": "both",
    "source": "MOCK",
    "year": 2000
  },
  {
    "age": 31,
    "geo": "AR",
    "persons": 485642.0,
    "retrieved_at": "2026-10-02",
    "sex": "both",
    "source": "MOCK",
    "year": 2000
  },
  {
    "age": 32,
    "geo": "AR",
    "persons": 479662.0,
    "retrieved_at": "2026-10-02",
    "sex": "both",
    "source": "MOCK",
    "year": 2000
  },
  {
    "age": 33,
    "geo": "AR",
    "persons": 473641.0,
    "retrieved_at": "2026-10-02",
    "sex": "both",
    "source": "MOCK",
    "year": 2000
  },
  {
    "age": 34,
    "geo": "AR",
    "persons": 467578.0,
    "retrieved_at": "2026-10-02",
    "sex": "both",
    "source": "MOCK",
    "year": 2000
  },
  {
    "age": 35,
    "geo": "AR",
    "persons": 461477.0,
    "retrieved_at": "2026-10-02",
    "sex": "both",
    "source": "MOCK",
    "year": 2000
  },
  {
    "age": 36,
    "geo": "AR",
    "persons": 455339.0,
    "retrieved_at": "2026-10-02",
    "sex": "both",
    "source": "MOCK",
    "year": 2000
  },
  {
    "age": 37,
    "geo": "AR",
    "persons": 449164.0,
    "retrieved_at": "2026-10-02",
    "sex": "both",
    "source": "MOCK",
    "year": 2000
  },
  {
    "age": 38,
    "geo": "AR",
    "persons": 442955.0,
    "retrieved_at": "2026-10-02",
    "sex": "both",
    "source": "MOCK",
    "year": 2000
  },
  {
    "age": 39,
    "geo": "AR",
    "persons": 436712.0,
    "retrieved_at": "2026-10-02",
    "sex": "both",
    "source": "MOCK",
    "year": 2000
  },
  {
    "age": 40,
    "geo": "AR",
    "persons": 430438.0,
    "retrieved_at": "2026-10-02",
    "sex": "both",
    "source": "MOCK",
    "year": 2000
  },
  {
    "age": 41,
    "geo": "AR",
    "persons": 424132.0,
    "retrieved_at": "2026-10-02",
    "sex": "both",
    "source": "MOCK",
    "year": 2000
  },
  {
    "age": 42,
    "geo": "AR",
    "persons": 417798.0,
    "retrieved_at": "2026-10-02",
    "sex": "both",
    "source": "MOCK",
    "year": 2000
  },
  {
    "age": 43,
    "geo": "AR",
    "persons": 411435.0,
    "retrieved_at": "2026-10-02",
    "sex": "both",
    "source": "MOCK",
    "year": 2000
  },
  {
    "age": 44,
    "geo": "AR",
    "persons": 405046.0,
    "retrieved_at": "2026-10-02",
    "sex": "both",
    "source": "MOCK",
    "year": 2000
  },
  {
    "age": 45,
    "geo": "AR",
    "persons": 398631.0,
    "retrieved_at": "2026-10-02",
    "sex": "both",
    "source": "MOCK",
    "year": 2000
  },
  {
    "age": 46,
    "geo": "AR",
    "persons": 392191.0,
    "retrieved_at": "2026-10-02",
    "sex": "both",
    "source": "MOCK",
    "year": 2000
  },
  {
    "age": 47,
    "geo": "AR",
    "persons": 385728.0,
    "retrieved_at": "2026-10-02",
    "sex": "both",
    "source": "MOCK",
    "year": 2000
  },
  {
    "age": 48,
    "geo": "AR",
    "persons": 379243.0,
    "retrieved_at": "2026-10-02",
    "sex": "both",
    "source": "MOCK",
    "year": 2000
  },
  {
    "age": 49,
    "geo": "AR",
    "persons": 372736.0,
    "retrieved_at": "2026-10-02",
    "sex": "both",
    "source": "MOCK",
    "year": 2000
  },
  {
    "age": 50,
    "geo": "AR",
    "persons": 366210.0,
    "retrieved_at": "2026-10-02",
    "sex": "both",
    "source": "MOCK",
    "year": 2000
  },
  {
    "age": 51,
    "geo": "AR",
    "persons": 359664.0,
    "retrieved_at": "2026-10-02",
    "sex": "both",
    "source": "MOCK",
    "year": 2000
  },
  {
    "age": 52,
    "geo": "AR",
    "persons": 353100.0,
    "retrieved_at": "2026-10-02",
    "sex": "both",
    "source": "MOCK",
    "year": 2000
  },
  {
    "age": 53,
    "geo": "AR",
    "persons": 346519.0,
    "retrieved_at": "2026-10-02",
    "sex": "both",
    "source": "MOCK",
    "year": 2000
  },
  {
    "age": 54,
    "geo": "AR",
    "persons": 339922.0,
    "retrieved_at": "2026-10-02",
    "sex": "both",
    "source": "MOCK",
    "year": 2000
  },
  {
    "age": 55,
    "geo": "AR",
    "persons": 333310.0,
    "retrieved_at": "2026-10-02",
    "sex": "both",
    "source": "MOCK",
    "year": 2000
  },
  {
    "age": 56,
    "geo": "AR",
    "persons": 326684.0,
    "retrieved_at": "2026-10-02",
    "sex": "both",
    "source": "MOCK",
    "year": 2000
  },
  {
    "age": 57,
    "geo": "AR",
    "persons": 320045.0,
    "retrieved_at": "2026-10-02",
    "sex": "both",
    "source": "MOCK",
    "year": 2000
  },
  {
    "age": 58,
    "geo": "AR",
    "persons": 313393.0,
    "retrieved_at": "2026-10-02",
    "sex": "both",
    "source": "MOCK",
    "year": 2000
  },
  {
    "age": 59,
    "geo": "AR",
    "persons": 306730.0,
    "retrieved_at": "2026-10-02",
    "sex": "both",
    "source": "MOCK",
    "year": 2000
  },
  {
    "age": 60,
    "geo": "AR",
    "persons": 300056.0,
    "retrieved_at": "2026-10-02",
    "sex": "both",
    "source": "MOCK",
    "year": 2000
  },
  {
    "age": 61,
    "geo": "AR",
    "persons": 293372.0,
    "retrieved_at": "2026-10-02",
    "sex": "both",
    "source": "MOCK",
    "year": 2000
  },
  {
    "age": 62,
    "geo": "AR",
    "persons": 286679.0,
    "retrieved_at": "2026-10-02",
    "sex": "both",
    "source": "MOCK",
    "year": 2000
  },
  {
    "age": 63,
    "geo": "AR",